{
  "$schema": "../schemas/private-api-compatibility.schema.json",
  "schemaVersion": 1,
  "updatedAt": "2026-08-03",
  "environments": [
    {
      "id": "lab-a-dsm-7-2-1-69057-u12-20260729",
      "deviceAlias": "lab-a",
      "baselineStatus": "current",
      "observedAt": "2026-07-29",
      "dsmVersion": "7.2.1",
      "dsmBuild": "69057",
      "dsmUpdate": "12",
      "packages": [
        {
          "id": "file-station",
          "name": "File Station",
          "version": "1.4.1-1559"
        },
        {
          "id": "storage-manager",
          "name": "存储管理器",
          "version": "1.0.0-0017"
        },
        {
          "id": "storage-analyzer",
          "name": "存储空间分析器",
          "version": "2.1.0-0620"
        },
        {
          "id": "download-station",
          "name": "Download Station",
          "version": "4.1.2-5012"
        },
        {
          "id": "virtual-machine-manager",
          "name": "Virtual Machine Manager",
          "version": "2.6.5-12202"
        },
        {
          "id": "container-manager",
          "name": "Container Manager",
          "version": "24.0.2-1535"
        },
        {
          "id": "synology-chat-server",
          "name": "Synology Chat Server",
          "version": "2.4.1-22111"
        },
        {
          "id": "synology-photos",
          "name": "Synology Photos",
          "version": "1.8.2-10090"
        }
      ],
      "evidenceRefs": [
        "docs/api/discovery/environments/2026-07-29-lab-a-dsm-69057-u12.md",
        "docs/compatibility/DSM_COMPATIBILITY_MATRIX.md"
      ],
      "notes": "通过已登录 DSM 信息中心和套件中心只读核实版本；未执行更新或其他写操作。"
    }
  ],
  "endpoints": [
    {
      "id": "quickconnect-relay-control",
      "componentId": "dsm-core",
      "scope": "QuickConnect",
      "capability": "直连失败后的中继发现与目标身份核对",
      "classification": "internal",
      "operation": "read",
      "risk": "high",
      "apiNames": [
        "get_server_info",
        "request_tunnel"
      ],
      "paths": [
        "Serv.php"
      ],
      "methods": [
        "POST"
      ],
      "fallback": "直连候选全部失败时才尝试；中继或身份核对失败则停止连接。",
      "documentRef": "docs/api/discovery/endpoints/INDEX.md",
      "verifications": [
        {
          "environmentId": "lab-a-dsm-7-2-1-69057-u12-20260729",
          "evidenceLevel": "behavior-verified",
          "status": "enabled",
          "versionMatrix": {
            "quickconnect-relay-control": "无数字 API 版本；当前协议行为已记录"
          },
          "verifiedAt": "2026-07-23",
          "evidenceRefs": [
            "docs/api/DSM_WEB_API_REFERENCE_ZH.md",
            "docs/compatibility/DSM_COMPATIBILITY_MATRIX.md"
          ],
          "notes": "已记录中继建立、身份核对和随后 SYNO.API.Info 探测；不记录控制主机或目标标识。"
        }
      ]
    },
    {
      "id": "file-station-remote-mount",
      "componentId": "file-station",
      "scope": "File Station",
      "capability": "SMB/NFS 远程位置创建、重连与断开",
      "classification": "internal",
      "operation": "write",
      "risk": "high",
      "apiNames": [
        "SYNO.FileStation.Mount"
      ],
      "paths": [
        "runtime-discovered-via-SYNO.API.Info"
      ],
      "methods": [
        "POST"
      ],
      "fallback": "接口缺失、无权限或无法用公开 getinfo 回读时关闭入口。",
      "documentRef": "docs/api/discovery/endpoints/INDEX.md",
      "verifications": [
        {
          "environmentId": "lab-a-dsm-7-2-1-69057-u12-20260729",
          "evidenceLevel": "observed",
          "status": "candidate",
          "versionMatrix": {
            "SYNO.FileStation.Mount": "v1；mount_remote / unmount"
          },
          "verifiedAt": "2026-07-27",
          "evidenceRefs": [
            "docs/api/DSM_WEB_API_REFERENCE_ZH.md",
            "docs/compatibility/DSM_COMPATIBILITY_MATRIX.md"
          ],
          "notes": "内部实验性契约；尚未在专用目标完成写行为验收。"
        }
      ]
    },
    {
      "id": "dsm-system-observability",
      "componentId": "dsm-core",
      "scope": "DSM",
      "capability": "系统、性能、连接、日志和更新状态",
      "classification": "internal",
      "operation": "mixed",
      "risk": "high",
      "apiNames": [
        "SYNO.Core.System",
        "SYNO.Core.System.Utilization",
        "SYNO.Core.CurrentConnection",
        "SYNO.Core.SyslogClient.Log",
        "SYNO.Core.Upgrade.Server",
        "SYNO.LogCenter.History"
      ],
      "paths": [
        "runtime-discovered-via-SYNO.API.Info"
      ],
      "methods": [
        "POST"
      ],
      "fallback": "各只读页面独立降级；连接断开不可用时不影响连接列表。",
      "documentRef": "docs/api/discovery/endpoints/INDEX.md",
      "verifications": [
        {
          "environmentId": "lab-a-dsm-7-2-1-69057-u12-20260729",
          "evidenceLevel": "read-verified",
          "status": "degraded",
          "versionMatrix": {
            "SYNO.Core.System": "info v3",
            "SYNO.Core.System.Utilization": "get v1",
            "SYNO.Core.CurrentConnection": "list / kick_connection v1；仅 list 已只读核对",
            "SYNO.Core.SyslogClient.Log": "list v1",
            "SYNO.Core.Upgrade.Server": "check v3",
            "SYNO.LogCenter.History": "客户端范围 v1"
          },
          "verifiedAt": "2026-07-27",
          "evidenceRefs": [
            "docs/api/DSM_WEB_API_REFERENCE_ZH.md",
            "docs/compatibility/DSM_COMPATIBILITY_MATRIX.md",
            "docs/api/discovery/endpoints/dsm-current-connection.md",
            "docs/api/discovery/endpoints/dsm-system-update-check.md"
          ],
          "notes": "连接断开属于写行为，本环境未执行，不能继承只读证据等级；系统更新只读检查已记录，下载与安装保持关闭。"
        }
      ]
    },
    {
      "id": "dsm-system-processes",
      "componentId": "dsm-core",
      "scope": "DSM 资源监控",
      "capability": "系统进程与服务进程组只读摘要",
      "classification": "internal",
      "operation": "read",
      "risk": "medium",
      "apiNames": [
        "SYNO.Core.System.Process",
        "SYNO.Core.System.ProcessGroup"
      ],
      "paths": [
        "runtime-discovered-via-SYNO.API.Info"
      ],
      "methods": [
        "POST"
      ],
      "fallback": "进程能力缺失时页面独立不可用；服务组缺失或失败时保留进程列表。命令、路径、账号和网络地址不进入模型。",
      "documentRef": "docs/api/discovery/endpoints/dsm-system-processes.md",
      "verifications": [
        {
          "environmentId": "lab-a-dsm-7-2-1-69057-u12-20260729",
          "evidenceLevel": "static",
          "status": "candidate",
          "versionMatrix": {
            "SYNO.Core.System.Process": "静态目录仅确认 list；客户端保守接受运行时发现的 v1，真实参数与响应未验证",
            "SYNO.Core.System.ProcessGroup": "静态目录确认 list / service_info；客户端仅候选接入 v1 list，service_info 保持关闭"
          },
          "verifiedAt": "2026-07-31",
          "evidenceRefs": [
            "docs/api/DSM_WEB_API_REFERENCE_ZH.md",
            "docs/api/discovery/endpoints/dsm-system-processes.md"
          ],
          "notes": "合成响应只验证字段白名单、500 项上限、能力缺失零请求和服务组失败降级，不提升真实环境证据等级。"
        }
      ]
    },
    {
      "id": "dsm-power-schedule",
      "componentId": "dsm-core",
      "scope": "DSM 控制面板",
      "capability": "电源计划只读摘要与保存禁用边界",
      "classification": "internal",
      "operation": "mixed",
      "risk": "high",
      "apiNames": [
        "SYNO.Core.Hardware.PowerSchedule"
      ],
      "paths": [
        "runtime-discovered-via-SYNO.API.Info"
      ],
      "methods": [
        "POST"
      ],
      "fallback": "能力缺失或 v1 不在发现范围时页面独立不可用且零请求；save 始终保持关闭。",
      "documentRef": "docs/api/discovery/endpoints/dsm-power-schedule.md",
      "verifications": [
        {
          "environmentId": "lab-a-dsm-7-2-1-69057-u12-20260729",
          "evidenceLevel": "static",
          "status": "candidate",
          "versionMatrix": {
            "SYNO.Core.Hardware.PowerSchedule": "静态目录仅确认 load / save；客户端保守接受运行时发现的 v1 load，save 禁用"
          },
          "verifiedAt": "2026-07-31",
          "evidenceRefs": [
            "docs/api/DSM_WEB_API_REFERENCE_ZH.md",
            "docs/api/discovery/endpoints/dsm-power-schedule.md"
          ],
          "notes": "合成响应只验证字段白名单、128 条上限、歧义星期降级、能力缺失零请求和零 save，不提升真实环境证据等级。"
        }
      ]
    },
    {
      "id": "dsm-external-storage",
      "componentId": "dsm-core",
      "scope": "DSM 控制面板",
      "capability": "USB 与 eSATA 外接存储只读摘要和安全弹出禁用边界",
      "classification": "internal",
      "operation": "mixed",
      "risk": "high",
      "apiNames": [
        "SYNO.Core.ExternalDevice.Storage.USB",
        "SYNO.Core.ExternalDevice.Storage.eSATA"
      ],
      "paths": [
        "runtime-discovered-via-SYNO.API.Info"
      ],
      "methods": [
        "POST"
      ],
      "fallback": "两个 list 独立发现和降级；均缺失时零请求，单项失败时保留另一项；USB eject 始终关闭。",
      "documentRef": "docs/api/discovery/endpoints/dsm-external-storage.md",
      "verifications": [
        {
          "environmentId": "lab-a-dsm-7-2-1-69057-u12-20260729",
          "evidenceLevel": "static",
          "status": "candidate",
          "versionMatrix": {
            "SYNO.Core.ExternalDevice.Storage.USB": "静态目录仅确认 list / eject；客户端保守接受运行时发现的 v1 list，eject 禁用",
            "SYNO.Core.ExternalDevice.Storage.eSATA": "静态目录仅确认 list；客户端保守接受运行时发现的 v1"
          },
          "verifiedAt": "2026-08-03",
          "evidenceRefs": [
            "docs/api/DSM_WEB_API_REFERENCE_ZH.md",
            "docs/api/discovery/endpoints/dsm-external-storage.md"
          ],
          "notes": "合成响应只验证字段白名单、明确字节单位、每类 64 项上限、局部降级、能力缺失零请求和零 eject，不提升真实环境证据等级。"
        }
      ]
    },
    {
      "id": "dsm-zram",
      "componentId": "dsm-core",
      "scope": "DSM 控制面板",
      "capability": "内存压缩启用状态、明确字节容量与算法白名单只读摘要",
      "classification": "internal",
      "operation": "mixed",
      "risk": "high",
      "apiNames": [
        "SYNO.Core.Hardware.ZRAM"
      ],
      "paths": [
        "runtime-discovered-via-SYNO.API.Info"
      ],
      "methods": [
        "POST"
      ],
      "fallback": "能力缺失或 v1 不在发现范围时页面独立不可用且零请求；单位不明确的容量和未知算法降级；set 始终关闭。",
      "documentRef": "docs/api/discovery/endpoints/dsm-zram.md",
      "verifications": [
        {
          "environmentId": "lab-a-dsm-7-2-1-69057-u12-20260729",